{
  "$schema": "http://json-schema.org/draft-07/schema#",
  "$id": "https://facts-h.iiitkottayam.ac.in/schemas/framework-knowledge-indicators.schema.json",
  "title": "Knowledge indicators for an outcome-based framework",
  "description": "Washington Accord WK indicators, or a body's equivalent.\n\nThese live in their own file rather than inside the outcome set because a knowledge indicator is a third mapping dimension alongside programme and programme-specific outcomes — a course outcome maps to POs *and* to WKs — and is not a property of either. NBA's SAR 2025 expects a CO-PO-WK mapping, so treating WK as a field on a PO would make that mapping impossible to express.\n\nThe outcome set points here via `knowledge_indicators_ref`, and each outcome cross-references the indicator codes it draws on.",
  "type": "object",
  "required": ["id", "body", "version", "kind", "source_document", "source_url", "retrieved_on", "verified_on", "knowledge_indicators"],
  "additionalProperties": false,
  "properties": {
    "$schema": { "type": "string" },

    "id": {
      "type": "string",
      "pattern": "^[a-z0-9-]+/[a-z0-9.-]+/[a-z0-9-]+$",
      "examples": ["nba/gapc-v4.0/wk-indicators"]
    },
    "body": { "type": "string" },
    "version": { "type": "string", "description": "The framework version these belong to." },
    "kind": { "const": "knowledge-indicators" },
    "label": { "type": "string" },
    "applies_to_framework": {
      "type": "string",
      "description": "Registry id of the outcome set these indicators accompany.",
      "examples": ["nba/gapc-v4.0"]
    },

    "source_document": { "type": "string", "minLength": 8 },
    "source_url": { "type": "string", "format": "uri" },
    "retrieved_on": { "type": "string", "format": "date" },
    "verified_on": {
      "type": ["string", "null"],
      "format": "date",
      "description": "Null until a human has checked each statement against the official manual. When null, verification_note is required."
    },
    "verification_note": { "type": "string", "minLength": 20 },

    "knowledge_indicators": {
      "type": "array",
      "minItems": 1,
      "items": {
        "type": "object",
        "required": ["code", "statement"],
        "additionalProperties": false,
        "properties": {
          "code": { "type": "string", "examples": ["WK1", "WK9"] },
          "sequence": { "type": "integer", "minimum": 1 },
          "title": { "type": "string" },
          "statement": {
            "type": "string",
            "minLength": 1,
            "description": "Official wording, verbatim — it is reproduced in the SAR mapping tables."
          },
          "added_in": {
            "type": "string",
            "description": "Framework version that introduced this indicator, where it did not exist previously."
          }
        }
      }
    },

    "notes": { "type": "string" }
  },

  "allOf": [
    {
      "if": { "properties": { "verified_on": { "type": "null" } }, "required": ["verified_on"] },
      "then": { "required": ["verification_note"] }
    }
  ]
}
