{
  "$schema": "../../../packages/schemas/framework-knowledge-indicators.schema.json",

  "id": "nba/gapc-v4.0/wk-indicators",
  "body": "NBA",
  "version": "gapc-v4.0",
  "kind": "knowledge-indicators",
  "label": "Washington Accord knowledge indicators (WK1–WK9), 2021 revision",
  "applies_to_framework": "nba/gapc-v4.0",

  "source_document": "Washington Accord graduate attributes and professional competency profiles, 2021 revision, as adopted by NBA GAPC v4.0",
  "source_url": "https://www.ieagreements.org/",
  "retrieved_on": "2026-07-29",
  "verified_on": null,
  "verification_note": "Transcribed from the 2021 Washington Accord revision. Structurally correct — nine indicators, with WK9 covering ethics and inclusive conduct newly introduced — but not checked word for word against either the IEA document or the NBA GAPC v4.0 manual that adopts it. These statements appear in SAR CO-PO-WK mapping tables, so a verifier must confirm each against the official text and set verified_on.",

  "notes": "SAR 2025 expects a CO-PO-WK mapping. A knowledge indicator is a third mapping dimension alongside programme and programme-specific outcomes rather than a property of either, which is why these are defined here and only cross-referenced from the outcome set.",

  "knowledge_indicators": [
    {
      "code": "WK1",
      "sequence": 1,
      "title": "Natural sciences",
      "statement": "A systematic, theory-based understanding of the natural sciences applicable to the discipline and awareness of relevant social sciences."
    },
    {
      "code": "WK2",
      "sequence": 2,
      "title": "Mathematics and analysis",
      "statement": "Conceptually-based mathematics, numerical analysis, data analysis, statistics and formal aspects of computer and information science to support detailed analysis and modelling applicable to the discipline."
    },
    {
      "code": "WK3",
      "sequence": 3,
      "title": "Engineering fundamentals",
      "statement": "A systematic, theory-based formulation of engineering fundamentals required in an engineering discipline."
    },
    {
      "code": "WK4",
      "sequence": 4,
      "title": "Specialist knowledge",
      "statement": "Engineering specialist knowledge that provides theoretical frameworks and bodies of knowledge for an accepted practice area in the engineering discipline, much of it at the forefront of the discipline."
    },
    {
      "code": "WK5",
      "sequence": 5,
      "title": "Design knowledge",
      "statement": "Knowledge, including efficient resource use, environmental impacts, whole-life cost, re-use of resources, net zero carbon, and similar concepts, that supports engineering design and operations in a practice area."
    },
    {
      "code": "WK6",
      "sequence": 6,
      "title": "Engineering practice",
      "statement": "Knowledge of engineering practice (technology) in the practice areas in the engineering discipline."
    },
    {
      "code": "WK7",
      "sequence": 7,
      "title": "Engineering in society",
      "statement": "Knowledge of the role of engineering in society and identified issues in engineering practice in the discipline, such as the professional responsibility of an engineer to public safety and sustainable development."
    },
    {
      "code": "WK8",
      "sequence": 8,
      "title": "Research literature",
      "statement": "Engagement with selected knowledge in the current research literature of the discipline, awareness of the power of critical thinking and creative approaches to evaluate emerging issues."
    },
    {
      "code": "WK9",
      "sequence": 9,
      "title": "Ethics and inclusive conduct",
      "statement": "Ethics, inclusive behaviour and conduct. Knowledge of professional ethics, responsibilities, and norms of engineering practice. Awareness of the need for diversity by reason of ethnicity, gender, age, physical ability etc. with mutual understanding and respect, and of inclusive attitudes.",
      "added_in": "gapc-v4.0"
    }
  ]
}
